{
  "id": "alcocer",
  "display_name_key": "location.alcocer",
  "beat": "a1_alcocer",
  "alfonso_protectorate": false,
  "keep_or_sell": true,
  "keep_past_deadline_fail": true,
  "sell_deadline_days": 3,
  "booty": {
    "marks": 600,
    "horses": 30,
    "cloth": 0,
    "arms": 0
  },
  "take_event_id": "alcocer_sortie_win",
  "sell_event_id": "alcocer_sell",
  "keep_event_id": "alcocer_keep"
}
